character,text
WARREN,"This is not going to be a one and done, that we do one thing or two things or three things and then we're done. We have to reduce gun violence overall. And the question we have to ask is, why hasn't it happened?"
WARREN,You say we're so close. We have been so close. I stood in the United States Senate in 2013...
COOPER, Thank you.
WARREN, ... when 54 senators voted in favor of gun legislation and it didn't pass because of the filibuster.
COOPER," Thank you, Senator. Senator..."
WARREN, We have got to attack the corruption and repeal the filibuster or the gun industry will always have a veto over what happens.
COOPER," Senator Harris? Senator Harris, you disagree with Senator Warren. You think the buyback should be mandatory. Please respond."
HARRIS," Five million assault weapons are on the streets of America today. During the course of this debate, eight people will die from gun violence. The leing cause of death of young black men in America is gun violence, more than the top other six reasons total."
HARRIS,This is a serious matter. I have personally hugged more mothers of homicide victims than I care to tell you. I have looked at more autopsy photographs than I care to tell you. I have attended more police officer funerals than I care to tell you. I'm done. And we need action.
HARRIS,"And Congress has h years to act and failed because they do not have the courage. When I'm elected, I'll give them 100 days to pull their act together, put a bill on my desk for signature, and if they don't, I will take executive action and put in place a comprehensive background check requirement and ban the importation of assault weapons into our country because it is time to act."
COOPER," Senator Biden -- Vice President Biden, your response."
BIDEN," I'm the only one on this stage who has taken on the NRA and beat them, and beat them twice. We were able to get assault weapons off the streets and not be able to be sold for 10 years. Recent studies show that mass violence went down when that occurred."
BIDEN,"The way to deal with those guns and those AR-15s and assault weapons that are on the street -- or not on the street, that people own, is to do what we did with the National Firearms Act as it related to machine guns. You must register that weapon. You must register it. When you register it, the likelihood of it being used diminishes exponentially."
BIDEN,"I'm the only one that got -- got -- moved the -- to make sure that we could not have a magazine that h more than 10 rounds in it. I've done this. I know how to get it done. If you really want to get it done, go after the gun manufacturers and take back the exemption they have of not being able to be sued. That would change it."
BIDEN,(APPLAUSE)
COOPER," Thank you, Mr. Vice President."
COOPER,"Secretary Castro, the vast majority of homicides committed with a gun in this country are from handguns, not assault-style weapons. What's your plan to prevent those deaths?"
CASTRO," Thank you very much for the question. You know, I grew up in neighborhoods where it wasn't uncommon to hear gunshots at night. And I can remember ducking into the back seat of a car when I was a freshman in high school, across the street from my school, my public school, because folks were shooting at each other."
CASTRO,"You know, in the neighborhoods -- let me answer this question about voluntary versus mandatory. There are two problems I have with mandatory buybacks. Number one, folks can't define it. And if you're not going door to door, then it's not really mandatory."
CASTRO,"But also, in the places that I grew up in, we weren't exactly looking for another reason for cops to come banging on the door. And you all saw a couple days ago what happened to Atatiana Jefferson in Fort Worth. A cop showed up at 2:00 in the morning at her house when she was playing video games with her nephew. He didn't even announced himself. And within four seconds, he shot her and killed her through her home window. She was in her own home."
CASTRO,"And so I am not going to give these police officers another reason to go door to door in certain communities, because police violence is also gun violence, and we need to dress that."
CASTRO,(APPLAUSE)
COOPER," Secretary Castro, thank you."
LACEY," Turning to another key issue here in Ohio and around the country, the opioid epidemic, Senator Klobuchar, CNN reached out to Ohio Democratic voters for their most pressing questions. Brie, a teacher in Proctorville, asks, in rural Ohio, the opioid epidemic has affected our communities and schools. I have many high school students who have lost one or both parents to heroin. Teachers are on the front lines daily, witnessing these tragedies. How will you tackle this problem in general, but specifically what will you offer people in rural communities where rehabilitation is not easily accessed and access to jobs is difficult?"
KLOBUCHAR," Well, I want to thank her for this question. This is something that should never have happened to begin with. I remember, when I was a prosecutor, these were not the kind of cases that were coming in our door. And it's gotten worse and worse. And we now know why."
KLOBUCHAR,"As the evidence is coming out of those lawsuits, probably one of the most horrible things that I saw was the e-mail from one of the pharma executives that actually said, ""Keep pumping them out. They're eating them like Doritos."""
KLOBUCHAR,"So my first answer to that question, and which is included in my plan, is that the people that should pay for this, that should pay for the treatment, are the very people that got people hooked and killed them in the first place. And that is the people that are manufacturing these opioids. That's the first way."
KLOBUCHAR,"And you can, with a 2 cents per milligram tax, bring in the money, plus with the federal master settlement, to help rural areas where they're so isolated, and also in urban areas, where it's, by the way, not just opiates. There are still mental health issues and crack cocaine issues."
KLOBUCHAR,"This is personal for me. My d, he struggled with alcoholism his whole life. And by his third DWI, they said to him, the prosecutor, you've got to face jail or you got to go to treatment. He picked treatment, and he was pursued by grace. And he has been sober ever since. And now he's 91 and in assisted living, and he said to me last year, it's hard to get a drink around here, anyway. But he still has an AA group that visits him there."
KLOBUCHAR,"And so for me, I believe that everyone in this country, including the people in rural America, have that same right to be pursued by grace."
LACEY," Thank you, Senator. Mr. Steyer, how would you dress the opioid epidemic that exists here in Ohio and around the country? Please respond."
STEYER," Well, I think this is one of the most heartbreaking experiences that America has h, 72,000 people died of opioid overdoses last year, and that's not only a tragedy for them, it's a tragedy for their family and their communities."
STEYER,And so I think we have to treat this as a health citizens. We have to move the resources and the support there to try and help people.
STEYER,But I think that Senator Klobuchar makes a good point. The reason I'm running for president is that we have a broken government. And we have a broken government because corporations have bought it. And every single one of these conversations is about that broken government. It's about drug companies buying the government and getting what they want. It's about the gun manufacturers buying the government and get what we want.
STEYER,"We need to break the corporate stranglehold on our government. I've put forward actual structural changes, including term limits, a natural referendum, the end to the idea that corporations are people and have the rights of American citizens politically, and make it a lot easier to vote"
STEYER,"These corporations have taken over our government. And 72,000 deaths..."
LACEY," Thank you, Mr. Steyer."
STEYER, ... last year are the tragic result.
LACEY," Thank you, Mr. Steyer. Mr. Yang, you want to decriminalize the possession and use of small amounts of opioids, including heroin. How would that solve the crisis?"
YANG," That's exactly right. And we have to recognize this is a disease of capitalism run amok. There was a point when there were more opiate prescriptions in the state of Ohio than human beings in the state of Ohio. And for some reason, the federal government thought that was appropriate."
YANG,"They ended up levying a $600 million fine against Purdue Pharma, which sounds like a lot of money, until you realize that company me $30 billion. They got a 2 percent fine, and they killed tens of thousands of Americans, eight an hour."
YANG,"So if the government turned a blind eye to this company spreing a plague among its people, then the least we can do is put the resources to work in our community so our people have a fighting chance to get well, even though this is not a money problem. We all know this is a human problem."
YANG,"And part of helping people get the treatment that they need is to let them know that they're not going to be referred to a prison cell. They will be referred to treatment and counseling. I talked to an EMT in New Hampshire, and he said he saves the same dicts over and over again, because the fact is, after you save someone who's OD'ing, you just bring them back to their house and they OD again the following week."
YANG,"So we need to decriminalize opiates for personal use. We have to let the country know this is not a personal failing. This was a systemic government failing. And then we need to open up safe consumption and safe injection sites around the country, because they save lives."
LACEY," Thank you, Mr. Yang. Congressman O'Rourke, is decriminalizing opioids part of the solution? Please respond."
O'ROURKE," Yes, it is, for many of the reasons that Mr. Yang just described. And also just from some personal experiences I've h as a member of Congress where constituents of mine have come forward, in some cases publicly, at a town hall meeting to describe their dictions."
O'ROURKE,"I remember a veteran telling me that he bought heroin off the street because he was originally prescribed an opioid at the V.A. Now, imagine if that veteran, inste of being prescribe an opioid, h been prescribed marijuana because we me that legal in America, ensured the V.A...."
YANG," Yes, preach, Beto."
O'ROURKE," ... could prescribe it, expunge the arrest records for those who've been arrested for possession, and make sure that he was not prescribed something to which he would become dicted."
O'ROURKE,"I also want to agree with Senator Klobuchar. Until we hold those responsible accountable for their actions, Purdue Pharma, Johnson & Johnson, we're going to continue to have this problem going on again. So that veteran that I met, and anyone with drug diction today, is not a problem for the criminal justice system."
LACEY, Thank you.
O'ROURKE, They're an opportunity for our public health system in America.
LACEY," Thank you, Congressman. Senator Harris, you want to hold the drug manufacturers that fueled the crisis accountable. Are you in favor of sending those drug company executives to jail?"
HARRIS," I am. And I will tell you, as a former prosecutor, I do think of this as being a matter of justice and accountability, because they are nothing more than some high-level dope dealers. They have been engaged..."
HARRIS,(APPLAUSE)
HARRIS,And I've seen it happen before. I've taken on the pharmaceutical companies when I was attorney general of California and led the second largest Department of Justice. I've seen what they do.
HARRIS,"The biggest pharmaceutical companies, the eight biggest pharmaceutical companies and insurance companies last year profited $72 billion on the backs of people like the families that we are talking about that have been overwhelmed by this crisis, which is a public health epidemic."
HARRIS,"And they knew what they were doing. They were marketing false vertising. They knew what they were pushing in communities and states like Ohio, without any concern about the repercussions because they were profiting and making big bucks. And, yes, they should be held accountable. This is a matter of justice."
HARRIS,"And so as president of the United States, I would ensure that the United States Department of Justice, understand that you want to deal with who is really a criminal? Let's end mass incarceration and end that failed war on drugs, and let's go after these pharmaceutical companies for what they've been doing to destroy our country and states like Ohio."
LACEY," Thank you, Senator. Secretary Castro, are you in favor of sending those drug company executives to prison? Please respond."
CASTRO," Yes, I am. They need to be held accountable, not only financially, but also with criminal penalties. And, you know, you can draw a straight line between making sure that we hold executives accountable, whether it's these drug manufacturers or Wall Street executives that should have been held accountable a dece-and-a-half ago."
LACEY, Thank you.
BURNETT," Now to the issue of candidates and their health. Senator Sanders, I want to start with you. We're moving on, Senator. I'm sorry."
SANDERS," I'm healthy. I'm feeling great, but I would like to respond to that question."
BURNETT, I want to -- I want start by saying...
BURNETT,(APPLAUSE)
BOOKER," And Senator Sanders is in favor of medical marijuana. I want to make sure that's clear, as well."
BURNETT," Senator Sanders, this debate does mark your..."
SANDERS, I do. I'm not on it tonight.
SANDERS,(LAUGHTER)
BURNETT," This debate -- this debate, sir, does mark your return to the campaign trail. Go ahe and finish your point and then I'll ask my question, Senator."
SANDERS," I'm more than happy to answer your question, but I wanted to pick up on what Kamala and Cory and others have said. Let's take a deep breath. Take a look at this opioid epidemic."
SANDERS,"You have executives, CEOs of major pharmaceutical companies, making tens of millions of dollars a year. And in this particular case with the opioids, they knew that they were selling a product to communities all over this country which were dicting people and killing them. And last year, the top 10 drug companies me $69 billion in profit."
SANDERS,"This is what unfettered capitalism is doing to this country. And it's not just the drug companies. Right now, the CEOs in the fossil fuel industry know full well that their product is destroying this world. And they continue to make huge profits."
BURNETT, Senator...
SANDERS, That is why we need a political revolution...
BURNETT," Thank you, Senator."
SANDERS, ... that says enough is enough to this behavior.
SANDERS,(APPLAUSE)
BURNETT," Senator, we are all very gl you're feeling well..."
SANDERS, Thank you.
BURNETT," ... as you just said. But there is a question on a lot of people's minds, and I want to dress it tonight. You're 78 years old, and you just h a heart attack. How do you reassure Democratic voters that you're up to the stress of the presidency?"
SANDERS," Well, let me invite you all to a major rally we’re having in Queens, New York, berniesanders.com. We’re going to have a special guest at that event. And we are going to be mounting a vigorous campaign all over this country. That is how I think I can reassure the American people."
SANDERS,"But let me take this moment, if I might, to thank so many people from all over this country, including many of my colleagues up here, for their love, for their prayers, for their well wishes. And I just want to thank you from the bottom of my heart. And I'm so happy to be back here with you this evening."
SANDERS,(APPLAUSE)
BURNETT," Vice President Biden, if you're elected, you will turn 80 during your first term. Last month, former President Jimmy Carter said he could not have undertaken the duties of the presidency at 80 years old. Why are you so sure that you can?"
BIDEN, Because I've watched it. I know what the job is. I've been engaged.
BIDEN,"Look, one of the reasons I'm running is because of my age and my experience. With it comes wisdom. We need someone to take office this time around who on day one can stand on the world stage, command the respect of world leers, from Putin to our allies, and know exactly what has to be done to get this country back on track."
BIDEN,"It is required now more than any time in any of our lifetimes to have someone who has that capacity on day one. That's one of the reasons why I decided to run, why I decided to run this time, because I know what has to be done. I've done it before. I've been there when we pulled the nation out of the worst financial recession in history. I've been there, and I've got so many pieces of legislation passed, including the Affordable Care Act, as well as making sure that we h the Recovery Act, which kept us from going into a depression."
BIDEN,"I know what has to be done. I will not need any on-the-job training the day I take office. And I will release my medical records, as I have 21 years of my tax records, which no one else on this stage has done, so that you can have full transparency as to my health and what I am doing."
BURNETT," Just to be clear, Mr. Vice President, when will you release those records?"
BIDEN, Before the first vote.
BURNETT, Before Iowa?
BIDEN, Yes.
BURNETT, Not by the end of this year?
BIDEN," Well, before Iowa. I mean, look, I've released them before. I released 55 pages of my -- I'm the only guy that's released anything up here."
BURNETT," Senator Warren, like Senator Sanders and Vice President Biden, if you win the presidency, you would be the oldest president ever inaugurated in a first term. You would be 71. Forty percent of Democratic primary voters say they think a candidate under the age of 70 is more likely to defeat President Trump. What do you say to them?"
WARREN," Well, I say, I will out-work, out-organize, and outlast anyone, and that includes Donald Trump, Mike Pence, or whoever the Republicans get stuck with."
WARREN,(LAUGHTER)
WARREN,"Look, the way I see this, the way we're going to win is by dressing he-on what millions of Americans know in their bones, and that is that the wealthy and the well-connected have captured our democracy, and they're making it work for themselves and leaving everyone else behind."
WARREN,"And political pundits and Washington insiders and, shoot, people in our own party don't want to mit that. They think that running some kind of vague campaign that nibbles around the edges of big problems in this country is a winning strategy. They are wrong."
WARREN,"If all Democrats can promise is after Donald Trump it will be business as usual, then we will lose. Democrats win when we call out what's broken and we show how to fix it. Democrats will win when we fight for the things that touch people's lives, things like childcare and health care and housing costs. Democrats will win when we give people a reason to get in the fight."
BURNETT," Thank you, Senator Warren."
BURNETT,"Congresswoman Gabbard, you're 38 years old, and you would be the youngest president if elected. Should age matter when choosing a president?"
GABBARD," I'm gl you asked, because I was going to say it's not fair to ask these three about their health and their fitness to serve as president but not every other one of us. I am grateful to have been trained very well by the Army and do my best to stay in shape."
GABBARD,"But here's the real question I believe you should be asking is Who is fit to serve as our commander-in-chief? This is the most important responsibility that the president has. What Donald Trump has been doing in Syria and what we have just seen with him, inviting Turkey to come in and slaughter the Kurds, show what an unfit president looks like. It highlights how critical it is that we have a president and commander-in-chief who is rey on day one, bringing experience and understanding in foreign policy and national security."
GABBARD,"Bringing the experience that I have, both serving in Congress now for nearly seven years, serving on the Foreign Affairs Committee, serving on the Armed Services Committee, subcommittees related to terrorism and upcoming threats, serving on the Homeland Security Committee, the experience that I have as a soldier, serving for over 16 years in the Army National Guard, deploying twice to the Middle East, being able to serve in different capacities, joint training exercises, training the Kuwait National Guard."
GABBARD,"I understand the importance of our national security. I am prepared to do this job, to fulfill this responsibility as commander-in-chief on day one."
BURNETT," Thank you, Congresswoman."
GABBARD, I'd like to ask our other candidates this question. I'd like to start with Senator Warren...
BURNETT," Sorry, Congressman, I'm sorry."
GABBARD, ... what her experience and background is to serve as commander-in-chief.
BURNETT," I'm sorry, thank you. We're going to take another break now. The CNN-New York Times debate live from Otterbein University here in Ohio will be back in just a few moments."
BURNETT,(COMMERCIAL BREAK)
COOPER, And welcome back to the CNN-New York Times Democratic presidential debate. Mark Lacey from the New York Times starts off our questioning. Mark?
LACEY," Thank you. Let's turn to the growing concerns over the power of big tech companies. Mr. Yang, Senator Warren is calling for companies like Facebook, Amazon, and Google to be broken up. Is she right? Does that need to happen?"
YANG," As usual, Senator Warren is 100 percent right in diagnosing the problem. There are absolutely excesses in technology and in some cases having them divest parts of their business is the right move."
YANG,"But we also have to be realistic that competition doesn't solve all the problems. It's not like any of us wants to use the fourth best navigation app. That would be like cruel and unusual punishment. There is a reason why no one is using Bing today. Sorry, Microsoft. It's true."
YANG,"So it's not like breaking up these big tech companies will revive Main Street businesses around the country. And as the parent of two young children, I'm particularly concerned about screen use and its effect on our children. Studies clearly show that we're seeing record levels of anxiety and depression coincident with smartphone option and social media use."
YANG,Breaking up the tech companies does nothing to make our kids healthier. What we have to do is we have to hone in on the specific problems we're trying to solve and use 21st century solutions for 21st century problems. Using a 20th century antitrust framework will not work. We need new solutions and a new toolkit.
LACEY," Thank you. Senator Warren, is Mr. Yang wrong? Your response, please."
WARREN," Look, I'm not willing to give up and let a handful of monopolists dominate our economy and our democracy. It's time to fight back. Think about it this way. When you talk about how it works in competition, about 8 percent, 9 percent of all retail sales happen at bricks and sticks stores, happen at Walmart. About 49 percent of all sales online happen in one place that's Amazon."
WARREN,"It collects information from every little business, and then Amazon does something else. It runs the platform, gets all the information, and then goes into competition with those little businesses. Look, you get to be the umpire in the baseball game, or you get to have a team, but you don't get to do both at the same time. We need to enforce our antitrust laws, break up these giant companies that are dominating, big tech, big pharma, big oil, all of them."
LACEY," Thank you, Senator."
LACEY,"Mr. Steyer, your response?"
STEYER," Look, I agree with Senator Warren that, in fact, monopolies have to be dealt with. They either have to be broken up or regulated, and that's part of it."
STEYER,"But we have to understand that Mr. Trump is going to be running on the economy. He's going to be saying he's the person who can make it grow. I started a business from scratch -- one room, no employers -- and built a multi-billion-dollar international business. We're going to have to show the American people that we don't just know how to tax and have programs to break up companies but also talk about prosperity, talk about investing in the American people, talk about harnessing the innovation and competition of the American private sector."
STEYER,"In fact, if we want to beat Mr. Trump, I think somebody who can go toe to toe with him and show him to be a fraud and a failure as a businessperson, and a fraud and a failure as a steward of the American economy is going to be necessary. He is one. His tax plan's a failure. His tre war is a failure. I would love to take him on as a real businessman and show that, in fact, he's failed the American people, and he has to go."
LACEY," Thank you, Mr. Steyer."
LACEY,"Senator Booker, how do you respond? Would a President Booker break up big tech companies like Facebook and Amazon?"
BOOKER," Anybody that does not think that we have a massive crisis in our democracy with the way these tech companies are being used, not just in terms of anti-competitive practices, but also to undermine our democracy -- we have seen it in the '16 election practices being used that have not been corrected now. We need regulation and reform."
BOOKER,"And antitrust, I mean Robert Bork right now is laughing in his sleep. We have a reality in this country where antitrust, from pharma to farms, is causing trouble, and we have to deal with this. As president of the United States, I will put people in place that enforce antitrust laws."
