character,text
BOOKER,"And I want to say one last thing, and I feel qualified to say this as the vegan on the stage. Going back to the fact that we -- it's rich to me that we asked three people about their health when looking at this stage we know that the most unhealthy person running for the presidency in 2020 is Donald Trump."
BOOKER,(APPLAUSE)
LACEY," Thank you, Senator."
LACEY,"Congressman O'Rourke, you say you're not sure if it's appropriate for a president to designate which companies should be broken up. So what's the proper level of oversight here?"
O'ROURKE," Yeah, we need to set very tough, very clear, transparent rules of the ro, the kind of rules that we do not have today, that allow these social media platforms, where we, the people, have become the product, to abuse that public trust, and to do so at extraordinary profits."
O'ROURKE,"Right now, we treat them functionally as a utility, when, in reality, they're more akin to a publisher. They curate the content that we see. Our pictures and personal information that they share with others, we would allow no publisher to do what Facebook is doing, to publish that  that Senator Warren has rightfully called out, that CNN has refused to air because it is untrue and tells lies about the vice president, treat them like the publisher that they are. That's what I will do as president."
O'ROURKE,"And we will be unafraid to break up big businesses if we have to do that, but I don't think it is the role of a president or a candidate for the presidency to specifically call out which companies will be broken up. That's something that Donald Trump has done, in part because he sees enemies in the press and wants to diminish their power. It's not something that we should do."
O'ROURKE,"So tough rules of the ro, protect your personal information, privacy, and data, and be fearless in the face of these tech giants."
LACEY," Senator Sanders, your response?"
SANDERS," When we talk about a rigged economy, it's not just the grotesque level of income and wealth inequality. It is also the fact that in sector after sector, whether it is Wall Street, where you have six banks that have assets equivalent to half of the GDP of the United States, whether it is media, where you have 10 media companies that control about 90 percent of what the American people see, hear, or re, whether it is agribusiness, where we see merger after merger which is resulting in the decline of family-based farming in this country, we need a president who has the guts to appoint an attorney general who will take on these huge monopolies, protect small business, and protect consumers by ending the price fixing that we see every day."
LACEY," Thank you, Senator. Thank you, Senator."
LACEY,"Senator Harris, to you, Facebook CEO Mark Zuckerberg says that splitting up big tech companies will make election interference more likely because the companies won't be able to work together to fight it. Could breaking up these companies make the spre of disinformation worse?"
HARRIS," No, I don't agree with that at all. And serving on the Senate Intelligence Committee, working with Amy Klobuchar on what we need to do to upgre the elections infrastructure, knowing that Russia needs to be held accountable for the fact that they interfered in the election of the president of the United States and will attempt to do it again, that's -- that's a ridiculous argument he's making."
HARRIS,"But I do want to also say this. What we're talking about is a grave injustice, when rules apply to some but not equally to all, and in particular when the rules that apply to the powerless don't apply to the powerful."
HARRIS,"And so, Senator Warren, I just want to say that I was surprised to hear that you did not agree with me that on this subject of what should be the rules around corporate responsibility for these big tech companies, when I called on Twitter to suspend Donald Trump's account, that you did not agree, and I would urge you to join me."
HARRIS,"Because here we have Donald Trump, who has 65 million Twitter followers and is using that platform as the president of the United States to openly intimidate witnesses, to threaten witnesses, to obstruct justice, and he and his account should be taken down."
HARRIS,"We saw in El Paso that that shooter in his manifesto was informed by how Donald Trump uses that platform, and this is a matter of corporate responsibility. Twitter should be held accountable and shut down that site. It is a matter of safety and corporate accountability."
LACEY," Thank you. Senator Warren, you can respond."
WARREN," So, look, I don't just want to push Donald Trump off Twitter. I want to push him out of the White House. That's our job."
HARRIS," Well, join me -- join me in saying that his Twitter account should be shut down."
WARREN, But let's figure -- no. Let's figure out...
HARRIS, No?
WARREN," ... why it is that we have h laws on the books for antitrust for over a century, and yet for deces now, we've all called on how the big drug companies are calling the shots in Washington, big ag, how the gun industry, big tech -- you know, we really need to dress the elephant in the room, and that is how campaigns are financed."
HARRIS, You can't say you're for corporate responsibility if it doesn't apply to everyone.
WARREN," I announced this morning -- I announced this morning that I'm not going to take any money from big tech executives, from Wall Street executives. We've alrey agreed, Bernie and I, we're not taking any money from big pharma executives."
WARREN,You can't go behind closed doors and take the money of these executives and then turn around and expect that these are the people who are actually finally going to enforce the laws. We need campaign finance rules and practices...
LACEY," Thank you, Senator Warren. Senator Harris?"
WARREN, ... that support us all.
HARRIS," You -- it does not represent a system of justice to say that the rules will apply differently to different people. This is a matter, you are saying, of holding big tech accountable."
WARREN, Yes.
HARRIS," Holding big tech accountable because they have an outsized influence on people's perceptions about issues, and they actually influence behaviors. We all have to agree this is their power. It is immense."
LACEY," Senator Klobuchar, let me bring you in here."
LACEY,(CROSSTALK)
LACEY, Your response?
HARRIS, I'm not finished. I'm not finished.
HARRIS,(CROSSTALK)
HARRIS, And so what I am saying is that it seems to me that you would be able to join me in saying the rule has to apply to Twitter the same way it does to Facebook.
WARREN," Look, I think all of the rules should apply across the board. I don't have a problem with that."
HARRIS, So you will join me in saying Twitter should shut down that account?
WARREN," What I do have a problem with is that if we're going to talk seriously about breaking up big tech, then we should ask if people are taking money from the big tech executives. If we're going to talk seriously about breaking up big drug companies, we should ask if people are financing their campaigns by taking money from big drug executives. If we are going to talk about Wall Street and having some serious regulation over Wall Street, we should ask if people are funding their campaigns by taking money from those executives."
LACEY," Thank you, Senator. Senator Klobuchar, let's bring you in here."
LACEY,(CROSSTALK)
KLOBUCHAR," I would like to have a different take on this. I was in the private sector for 14 years, represented companies that were fighting to get into the telecom markets. I h a life before government."
KLOBUCHAR,"And what I saw was when we got more competition there, the prices went down in a big way in the long distance market. Well, right now we have another gilded age going on, and I am the le Democrat on the Antitrust Committee. I have the le legislation, which means, one, changing the standard so we can do a better job of doing just what we've been talking about here, is breaking down some of this consolidation, and also making sure that the enforcers have the resources to take them on because they're so overwhelmed."
KLOBUCHAR,"But the issue here is this. Start talking about this as a pro-competition issue. This used to be a Republican and Democratic issue, because America, our founding fathers, actually wanted to have less consolidation. We were a place of entrepreneurship. We are seeing a startup slump in this country."
LACEY," Thank you, Senator. Secretary Castro, would you like to weigh in?"
KLOBUCHAR, And this means everything from tech on down.
LACEY, Please respond.
CASTRO," Yeah, I think that we're on the right track in terms of updating how we look at monopolistic practices and setting, as Congressman O'Rourke said, rules for the ro that match the challenges that we face today."
CASTRO,"And, you know, whether that's Amazon that is leveraging its size I think to help put small businesses out of business, and then at the same time shortchanging a lot of its workers, not paying them as they should, not giving them the benefits that they should, or it's a number of other companies, big tech companies. We need to take a stronger stance when it comes to cracking down on monopolistic tre practices, and that's what I would do as president."
LACEY," Thank you, Mr. Secretary."
LACEY,(CROSSTALK)
YANG," The best way we can fight back -- the best way we can fight back against big tech companies is to say our data is our property. Right now, our data is worth more than oil. How many of you remember getting your data check in the mail? It got lost. It went to Facebook, Amazon, Google. If we say this is our property and we share in the gains, that's the best way we can balance the scales against the big tech companies."
BURNETT," Thank you, Mr. Yang."
GABBARD, There's a bigger issue here...
BURNETT," Turning to women's reproductive rights, Ohio is now one of several states that has banned abortions after as early as six weeks of pregnancy. Many women don't even know they're pregnant at that time. The Ohio law, like many others, is being challenged in the courts and has not yet taken effect. Senator Harris, if states prevail on restricting abortion, what's your plan to stop them?"
HARRIS," My plan is as -- as follows. For any state that passes a law that violates the Constitution, and in particular Roe v. We, our Department of Justice will review that law to determine if it is compliant with Roe v. We and the Constitution, and if it is not, that law will not go into effect. That's called pre-clearance."
HARRIS,"Because the reality is that while we still have -- as I said earlier -- these state legislators who are outdated and out of touch, mostly men who are telling women what to do with their bodies, then there needs to be accountability and consequence."
HARRIS,(APPLAUSE)
HARRIS,"But, you know, I'll go further. You may have seen it. I questioned Brett Kavanaugh when I was a member of the Senate Judiciary Committee and asked him as a nominee to serve on the United States Supreme Court, could he think of any law that tells a man what to do with his body? And the answer was, uh, uh, no."
HARRIS,"The reality of it is, this is still a fundamental issue of justice for women in America. Women have been given the responsibility to perpetuate the human species. Our bodies were created to do that. And it does not give any other person the right to tell a woman what to do with that body. It is her body. It is her right. It is her decision."
HARRIS,(APPLAUSE)
BURNETT," Senator Harris, thank you."
BURNETT,"Senator Klobuchar, what would you do to stop states from prevailing? Your response?"
KLOBUCHAR," I would codify Roe v. We and make it the law of the land. But what I want to do right now is just say, what if Donald Trump was standing up here on the debate stage with me? You know what I would say to him? I said, you knew -- you said you wanted to do this in your race for president. You actually said that you wanted to put women in jail. Then you tried to dial it back, and you said you wanted to put doctors in jail."
KLOBUCHAR,"That is exactly what the Alabama law is. It put doctors in jail for 99 years. You, Donald Trump, are not on the side of women. You are not on the side of people of this country, when over 75 percent of people want to keep Roe v. We on the book, when over 90 percent of people want to make sure we have available contraception. You defunded Planned Parenthood. I would fund it again."
BURNETT," Senator, thank you."
BURNETT,"Senator Booker, if states prevail on restricting abortion, how would you stop them? Please respond."
BOOKER," Well, first of all, let's be clear about these laws we see from Alabama to Ohio. They're not just attacks on one of the most sacrosanct ideals in our country -- liberty, the ability to control your own body -- but they're particularly another example of people trying to punish, trying to penalize, trying to criminalize poverty, because this is disproportionately affecting low-income women in this country, people in rural areas in this country. It is an assault on the most fundamental ideal that human beings should control their own body."
BOOKER,"And so the way as president of the United States I'm going to deal with this is, first of all, elevating it like we have with other national crises to a White House-level position. And I will create the Office of Reproductive Freedom and Reproductive Rights in the White House and make sure that we begin to fight back on a systematic attempt that's gone on for deces to undermine Roe v. We."
BOOKER,"I will fight to codify it, and I will also make sure that we fight as this country to repeal the Hyde amendment, so that we are leing the Planet Earth in defending the global assault we see on women right now."
BURNETT," Thank you, Senator."
BURNETT,"Congresswoman Gabbard, your response?"
GABBARD," This is often one of the most difficult decisions that a woman will ever have to make, and it's unfortunate to see how in this country it has for so long been used as a divisive political weapon."
GABBARD,"I agree with Hillary Clinton on one thing, disagree with her on many others, but when she said abortion should be safe, legal, and rare, I think she's correct. We see how the consequences of laws that you're referring to can often le to a dangerous place, as we've seen them as they're passed in other countries, where a woman who has a miscarriage past that six weeks could be imprisoned because abortion would be illegal at that point."
GABBARD,"I do, however, think that there should be some restrictions in place. I support codifying Roe v. We while making sure that, during the third trimester, abortion is not an option unless the life or severe health consequences of a woman are at risk."
BURNETT, Thank you very much.
BURNETT,The Supreme Court is currently me up of five Republican-appointed justices and four appointed by Democrats. The court just announced it will hear arguments in a case challenging some abortion rights.
BURNETT,"Vice President Biden, the Constitution does not specify the number of justices that serve on the Supreme Court. If Roe v. We is overturned on your watch and you can't pass legislation in Congress, would you seek to d justices to the Supreme Court to protect women's reproductive rights?"
BIDEN," I would not get into court packing. We h three justices. Next time around, we lose control, they d three justices. We begin to lose any credibility the court has at all."
BIDEN,"I want to point out that the justices I've supported, when I defeated Robert Bork -- and I say when I defeated Robert Bork, I me sure we guaranteed a woman's right to choose for the better part of a generation. I would make sure that we move and insist that we pass, we codify Roe v. We."
BIDEN,"The public is alrey there. Things have changed. And I would go out and I would campaign against those people in the state of Ohio, Alabama, et cetera, who in fact are throwing up this barrier. Reproductive rights are a constitutional right. And, in fact, every woman should have that right."
BIDEN,"And so I would not pack the court. What I would do is make sure that the people that I recommended for the court, from Ruth Ber Ginsburg to Elena Kagan, who used to work for me, to others, that they, in fact, support the right of privacy, on which the entire notion of a woman's right to choose is based. And that's what I would do. No one would get on the court."
BIDEN,"And by the way, if, in fact, at the end of this -- beginning next year, if, in fact, one of the justices steps down, God forbid, in fact, I would make sure that we would do exactly what McConnell did last time out. We would not allow any hearing to be held for a new justice."
BURNETT," Thank you, Mr. Vice President."
BURNETT,"Mayor Buttigieg, you have discussed expanding the court from 9 to 15 justices. What's your response to the vice president?"
BUTTIGIEG," That's right. When I proposed reforming the Supreme Court, some folks said that was too bold to even contemplate. Now, I'm not talking about packing the court just with people who agree with me, although I certainly will appoint people who share my values, for example, the idea that women's reproductive freedom is an American right."
BUTTIGIEG,"What I'm talking about is reforms that will depoliticize the court. We can't go on like this, where every single time there is a vacancy, we have this apocalyptic ideological firefight over what to do next."
BUTTIGIEG,"Now, one way to fix this would be to have a 15-member court where five of the members can only be appointed by unanimous agreement of the other 10. Smarter legal minds than mine are discussing this in the Yale Law Journal and how this could be done without a constitutional amendment. But the point is that not everybody arrives on a partisan basis."
BUTTIGIEG,"There are other reforms that we could consider, from term limits -- don't forget, justices used to just retire like everybody else -- to a rotation off the appellate bench."
BURNETT, Thank you.
BUTTIGIEG," I'm not wedded to a particular solution, but I am committed to establishing a commission on day one..."
BURNETT," Thank you, Mayor Buttigieg."
BUTTIGIEG," ... that will propose reforms to depoliticize the Supreme Court, because we can't go on like this."
BURNETT," Thank you very much, Mayor Buttigieg. Secretary Castro, he's talking about making the court bigger. Your response? Is it a good idea?"
CASTRO," I don't think it is. I wouldn't pack the court. You know, I think the plan that Mayor Pete mentioned is an interesting one, but I actually believe, if we were selecting from one of those things, that the smarter move might be to look at term limits or having people cycle off from the appellate courts so that you would have a replenishment of perspective."
CASTRO,"I would also make sure that I appoint as president people who respect the precedent of Roe v. We, that we codify Roe v. We, and that we do away with things like the Hyde amendment, because you shouldn't only be able to have reproductive freedom if you have money. We have to think about people who do not, people who are poor. And we have to concern ourselves not only with reproductive freedom, but also reproductive justice and invest in the ability of every woman to be able to make a choice and to be able to have her health care needs met."
BURNETT," Senator Warren, would you consider ding more justices to the Supreme Court to protect Roe v. We? Your response?"
WARREN," I think there are a number of options. I think, as Mayor Buttigieg said, there are many different ways. People are talking about different options, and I think we may have to talk about them."
WARREN,"But on Roe v. We, can we just pause for a minute here? I lived in an America where abortion was illegal, and rich women still got abortions, because they could travel, they could go to places where it was legal."
WARREN,"What we're talking about now is that the people who are denied access to abortion are the poor, are the young, are 14-year-olds who were molested by a family member. And we now have support across this country. Three out of four Americans believe in the rule of Roe v. We. When you've got three out of four Americans supporting it, we should be able to get that passed through Congress."
BURNETT," Senator, thank you."
WARREN," We should not leave this to the Supreme Court. We should do it through democracy, because we can."
BURNETT," Thank you very much, Senator."
COOPER," As some of you have indicated, the differences between all of you on this stage are tiny compared to the differences between you and President Trump. There are, however, fundamental differences between many of you on this stage."
COOPER,"Vice President Biden, just on either side of you, Senator Warren is calling for big structural change. Senator Sanders is calling for a political revolution. Will their visions attract the kind of voters that the Democrats need to beat Donald Trump?"
BIDEN," Well, I think their vision is attracting a lot of people, and I think a lot of what they have to say is really important. But, you know, Senator Warren said we can't be running any vague campaigns. We've got to level with people. We've got to level with people and tell them exactly what we're going to do, how we're going to get it done, and if you can get it done."
BIDEN,"I'm going to say something that is probably going to offend some people here, but I'm the only one on this stage that has gotten anything really big done, from the Violence Against Women Act to making sure that we pass the Affordable Care Act to being in a position where we, in fact, took almost a $90 billion act that kept us from going into a depression, making us -- putting us in a position where I was able to end roe -- excuse me, able to end the issue of gun sales in terms of assault weapons."
BIDEN,"And so the question is, who is best prepared? We all have good ideas. The question is, who is going to be able to get it done? How can you get it done? And I'm not suggesting they can't, but I'm suggesting that that's what we should look at. And part of that requires you not being vague. Tell people what it's going to cost, how you're going to do it, and why you're going to do it. That's the way to get it done. Presidents are supposed to be able to persue."
COOPER," Just to clarify, Vice President, who are you saying is being vague?"
BIDEN," Well, the senator said -- she's being vague on the issue of -- actually, both are being vague on the issue of Medicare for all. No, look, here's the deal. Come on. It costs $30 trillion. Guess what? That's over $3 trillion -- it's more than the entire federal budget -- let me finish, OK?"
COOPER, You'll both get in.
BIDEN," If you eliminated the entire Pentagon, every single thing, plane, ship, troop, the buildings, everything, satellites, it would get you -- it would pay for a total of four months. Four months. Where do you get the rest? Where does it come from?"
SANDERS, Two things. Let me explain in two ways.
COOPER," Senator Sanders, respond."
SANDERS," Joe, you talked about working with Republicans and getting things done. But you know what you also got done? And I say this as a good friend. You got the disastrous war in Iraq done. You got a bankruptcy bill, which is hurting middle-class families all over this country. You got tre agreements, like NAFTA and PNTR, with China done, which have cost us 4 million jobs."
SANDERS,"Now, let's get to Medicare for all. Let's be honest. We spend twice as much per person as do the people of any other major country on Earth. And the answer is, if we have the guts that I would like to see the Democratic Party have that guts, to stand up to the drug companies and the insurance companies and tell them that the function of health care is to guarantee care to all people, not to make $100 billion in profit."
COOPER," Thank you, Senator."
SANDERS," If we stood together, we could create the greatest health care system in the world."
COOPER," Vice President Biden, you can respond, and then Senator Warren."
BIDEN, We can do that without Medicare for all. We can do that by ding a public option.
SANDERS, No.
BIDEN, We can.
SANDERS," No, you can't."
BIDEN, And we can afford to do it.
SANDERS, You've got to take on the greed and the profiteering of the health care industry.
BIDEN," By the way, the greed and..."
COOPER, Let him respond. Mr. Vice President?
BIDEN," The greed and profiteering of those insurance companies, they are as much against my bill as they are anybody else. They were strongly against Obamacare. They know it cost them. And it's going to take away the right of people to choose, the 160 million people out there who've negotiated their health insurance, and they want to keep it. They should have a right to keep it."
COOPER," Senator Warren, your response?"
WARREN," So you started this question with how you got something done. You know, following the financial crash of 2008, I h an idea for a consumer agency that would keep giant banks from cheating people. And all of the Washington insiders and strategic geniuses said, don't even try, because you will never get it passed."
WARREN,"And sure enough, the big banks fought us. The Republicans fought us. Some of the Democrats fought us. But we got that agency passed into law. It has now forced big banks to return more than $12 billion directly to people they cheated."
WARREN,"I served in the Obama ministration. I know what we can do by executive authority, and I will use it. In Congress, on the first day, I will pass my anti-corruption bill, which will beat back the influence of money..."
COOPER," Thank you, Senator."
WARREN," ... and repeal the filibuster. And the third, we want to get something done in America, we have to get out there and fight..."
COOPER," Thank you, Senator."
WARREN, ... for the things that touch people's lives.
